{"artifact_hash":"8652fbbc6842fd3e6781be465055eca8666e4d32a611e97c5513dbfa680ebcf5","energy_foundation":{"file_hash":"3ba8d291507614a6359cd8fc577bbb3b6089042997eb86bba2a6342ed2760377","logical_hash":"3242040be6750822ab4c540bd9a9da2360f3510f14446b1285c78369cfb8568f","path":"objects/sha256/3b/3ba8d291507614a6359cd8fc577bbb3b6089042997eb86bba2a6342ed2760377.safetensors"},"fields":[{"field_hash":"a59db8bad9ee756903522fb517bfcd32e331ad91ad7d297b91c29b71222fb344","field_id":"bounded-agent-skill-en-1.0","kind":"INSTRUCTION","logical_hash":"3c1858f8d69029c12b9c7d2971b4c47214e5e4579d0f09aa198d27d5747b59b7","object_hash":"165db5417b78779f0445636d88407cddc7b133e3dda32be1919e5c0a59f4859c"},{"field_hash":"17c0b5e63a566e9b8acdcc35079d67f3f84d95495b01ba7b24f10c03d57b3dc4","field_id":"bounded-json-python-surface-en-1.0","kind":"SURFACE_STRUCTURED","logical_hash":"35fb5609f4f63552aba8cc38450f5ce3e35645a0cf47d097637ecc1243ca34a7","object_hash":"5d72c9c758269a92ba40e3b28da3fce25242a3fba35c6f862c3120487bd2c201"},{"field_hash":"1f1952759dea3c0513f22afaa091b468f9cee1577c711b7c987f7e63ea43435d","field_id":"bounded-natural-surface-en-1.0","kind":"SURFACE_NATURAL","logical_hash":"b3201eb0e3b731e1130e5e9c335049a0796e3b5e17fab8237a941f3bffa42258","object_hash":"44247cdc1bf0fd088122f91e0323fcdc8885999913c98f7f8b4860df8bfe82fe"},{"field_hash":"166d78d3f01cc03f9f599ceed7625fa41335334df5d153ccb83aa41320d32ef5","field_id":"bounded-python-function-surface-en-1.0","kind":"SURFACE_PYTHON","logical_hash":"7c361a8d5dca0bb10e4bfb527870f56f018cd6c014c52475f1ac2b284b0fd403","object_hash":"f2a28cd99510acebccb682f4d550f4810b19a12f466c8633997fe879d8897f1f"},{"field_hash":"3b2603b021bb8ec65553bbdaf43bd5535a903b1cbeefe22f3a0852292a9b54ef","field_id":"runtime-v5-rich-output-surface-en-1.0","kind":"SURFACE_RICH","logical_hash":"4cb2e3460e0ddbd054f9fa8b19dcef56b31ad2fcf71e7065fab559171c222e71","object_hash":"b8dae9dc9c9be7090013af63b2ce1b762c34c94331e250750617aaf1b0937b5b"}],"kernel_foundation":{"foundation_hash":"763371dff4060e4a8eae8259ca515e041b881a734adba38d3da3caa660da9da6","foundation_id":"kernel-foundation-763371dff4060e4a8eae8259","manifest_hash":"d443a6d227d9139f824b5f640e52f7c082213453b3e6bd6dfe2cd783223da300","path":"kernel-foundation"},"members":{"kernel-foundation/kernel-foundation.json":"d443a6d227d9139f824b5f640e52f7c082213453b3e6bd6dfe2cd783223da300","kernel-foundation/worlds/input-world.json":"c5963bb85deac009fd4dfdaa65a1d512b966e05b61a92505f5f2bb5eb3d97f1a","kernel-foundation/worlds/main-world.json":"ed09b3158b743659516efabfd0922a7b0b064094f3a3e0de167a3bae65d63234","kernel-foundation/worlds/surface-world.json":"a833331c654a6da587abd7181e94588258974dcb6dd3d90f1b41ff83f52ff569","objects/sha256/00/003a1647c801c9a686a2888efddc18616e698d7f1e3742a9d229a6976de51ce9.safetensors":"003a1647c801c9a686a2888efddc18616e698d7f1e3742a9d229a6976de51ce9","objects/sha256/16/165db5417b78779f0445636d88407cddc7b133e3dda32be1919e5c0a59f4859c.safetensors":"165db5417b78779f0445636d88407cddc7b133e3dda32be1919e5c0a59f4859c","objects/sha256/38/38f5e038982e34577a54d270a95447d4d3e6a83e7b6b4943e6ae36380f0ac5da.safetensors":"38f5e038982e34577a54d270a95447d4d3e6a83e7b6b4943e6ae36380f0ac5da","objects/sha256/3b/3ba8d291507614a6359cd8fc577bbb3b6089042997eb86bba2a6342ed2760377.safetensors":"3ba8d291507614a6359cd8fc577bbb3b6089042997eb86bba2a6342ed2760377","objects/sha256/3e/3e2856274256804fc56cc392f2ba15dedab588c4fbcc6a5776f1b46764b2c1f0.safetensors":"3e2856274256804fc56cc392f2ba15dedab588c4fbcc6a5776f1b46764b2c1f0","objects/sha256/44/44247cdc1bf0fd088122f91e0323fcdc8885999913c98f7f8b4860df8bfe82fe.safetensors":"44247cdc1bf0fd088122f91e0323fcdc8885999913c98f7f8b4860df8bfe82fe","objects/sha256/48/486c1d0f2c344eae97b896fbeca081d78dbb87bedac82441943b38efd106a8b5.safetensors":"486c1d0f2c344eae97b896fbeca081d78dbb87bedac82441943b38efd106a8b5","objects/sha256/5d/5d72c9c758269a92ba40e3b28da3fce25242a3fba35c6f862c3120487bd2c201.safetensors":"5d72c9c758269a92ba40e3b28da3fce25242a3fba35c6f862c3120487bd2c201","objects/sha256/70/70b96a88ae1de16028fd166da507d113784e10c9165e0e8d9b9115faa5ec1ca9.safetensors":"70b96a88ae1de16028fd166da507d113784e10c9165e0e8d9b9115faa5ec1ca9","objects/sha256/97/971a318b82f519aa9a2fe0875533f799cd0955e33870071911584b761b9285dc.safetensors":"971a318b82f519aa9a2fe0875533f799cd0955e33870071911584b761b9285dc","objects/sha256/b2/b29efdce1f249aa36ca1b9a0f45fff202b7cfdccce9e69324eede69d19bdd1af.safetensors":"b29efdce1f249aa36ca1b9a0f45fff202b7cfdccce9e69324eede69d19bdd1af","objects/sha256/b8/b8dae9dc9c9be7090013af63b2ce1b762c34c94331e250750617aaf1b0937b5b.safetensors":"b8dae9dc9c9be7090013af63b2ce1b762c34c94331e250750617aaf1b0937b5b","objects/sha256/df/df7eafbc4bbaabdebd6bde91f0eb12f00bc6f2d802aea3d90b38b70a7023b517.safetensors":"df7eafbc4bbaabdebd6bde91f0eb12f00bc6f2d802aea3d90b38b70a7023b517","objects/sha256/ec/ec7f6cbe774032b67704fe025cd99d1a9fc7c327d230d97ec6be8b6b576aba66.safetensors":"ec7f6cbe774032b67704fe025cd99d1a9fc7c327d230d97ec6be8b6b576aba66","objects/sha256/f2/f2a28cd99510acebccb682f4d550f4810b19a12f466c8633997fe879d8897f1f.safetensors":"f2a28cd99510acebccb682f4d550f4810b19a12f466c8633997fe879d8897f1f","objects/sha256/fa/faf3235d0507f575cc5a2218280665040426b52e39c49cb83e00768633c2f1c9.safetensors":"faf3235d0507f575cc5a2218280665040426b52e39c49cb83e00768633c2f1c9","runtime/moth_runtime_v5_0/__init__.py":"069868fcf023a0fcf5a8c403a8b309417b770060cae858970d51b5aa18d3c550","runtime/moth_runtime_v5_0/__main__.py":"935a1c1166b0c1ea35a82256345000bf2c73ded718d77773bc27a71ecce28f7d","runtime/moth_runtime_v5_0/archive.py":"2e75e78cd900e53c58028f74a34b037f917b3787e9fc2b10eb1b223f0dc89a15","runtime/moth_runtime_v5_0/canonical.py":"1468b1afa7e2ca92d02720585feb88c258704bd90ecfb3a028dc28b87923a4ef","runtime/moth_runtime_v5_0/cli.py":"0048c2180e19ee9304b24a7d44b80c8920ff77551b6b3f9a1f4cef65ac96f193","runtime/moth_runtime_v5_0/compiler.py":"26721ffdfab9fbffff2307fbdcd86ad4d970c1a17f79a5d078d3371755bf19a4","runtime/moth_runtime_v5_0/encoder.py":"4021342ad25e131dec9b3995a2d8ec2ac9bc5b6c25505f90f93cb24e555bfea9","runtime/moth_runtime_v5_0/energy.py":"90e91dcad4f0c420840ac1fb4e38b3628eb1c63faa9bc9b9b15453e7b0db7136","runtime/moth_runtime_v5_0/factor.py":"07b1890a0aa527b2b6d23e36845de0062fc792c40bfce48dc68358943bbe80e2","runtime/moth_runtime_v5_0/grounding.py":"356bd948b26ea792fcf1e9366a62726ffd5fcfc201c644b54d47aca6ba9ee73c","runtime/moth_runtime_v5_0/handoff.py":"1f4504b2c28722fdc63859efd660de336d0220980b33e027ef6ec90728c29580","runtime/moth_runtime_v5_0/model.py":"707cd73f3e939ae74cfcdfbc0c093015991c65c71450cde2690ae0eafe421763","runtime/moth_runtime_v5_0/python_adapter.py":"6d305e1a7c2e3b1ab5c775aa431cfea29aa27035ccdb46c6cd8d73d038dc7836","runtime/moth_runtime_v5_0/runtime.py":"db7b17c722151a5b35751d7e79c5ef42ba51670104233786b4ffaaa78afbf543","runtime/moth_runtime_v5_0/semantic.py":"efdd84e90a4f7ffbdeb99b97a25dd6db7ab7d3a3307c358c0e7537fc77ae6c1a","runtime/moth_runtime_v5_0/store.py":"feec843a8ebb29f292d8003b697268c33c6be0e4ffdfad31d17247177ca9b23d","runtime/moth_runtime_v5_0/structure.py":"5ebe520aa79d9f4a6f2a5910cd9edc742a60c39894a44e3b5c70baccd9669a02","runtime/moth_runtime_v5_2/__init__.py":"258c251308ce2e2f762decd9e1656979685f65809c6ace9296cab69452089da2","runtime/moth_runtime_v5_2/__main__.py":"76fa916e93e0ae1a6c1bb51dcc0bcf289c014e9f760a47165f8a84401ccf41d7","runtime/moth_runtime_v5_2/artifact.py":"bb755b2cb5bc7c4d5f13b9b5a803ebc3f8c5eb8fbfd4646ab2b9179268045d94","runtime/moth_runtime_v5_2/assets.py":"9f278103b8acb235b5e081e4c3b7387e34197df6f2d8b2589f1cae0d54821501","runtime/moth_runtime_v5_2/canonical.py":"3dbb87b9a6ee869464dad95c0b49ef3bf972191354a9eb9450d2719a4e04d8f4","runtime/moth_runtime_v5_2/cli.py":"1e01da2862de8295a8ab61a3774a7b6fed950311f9e4498ce694228265a2e746","runtime/moth_runtime_v5_2/compile/__init__.py":"cfc254110e5564492686f049ca39c1036d118ce1376a8ef109ac99a1c8509fc8","runtime/moth_runtime_v5_2/compile/fields.py":"3d13e5bfcf2e1edb37eb802fa6b780ae18b62857c0a857c7a3659b95ffaa09fa","runtime/moth_runtime_v5_2/compile/hcf.py":"628b830a3e064a519dc4c4f0c7bf6aa817f3508de2e0ae286e131fd2e138dd6c","runtime/moth_runtime_v5_2/compile/skills.py":"58fe7e21d5957b4ff9a6a96b121a9ca47e722a66d047cc8491acf1bbc3cdc7ec","runtime/moth_runtime_v5_2/compile/symbols.py":"2d4691db94ecae94937b20fcd89bac7af1c72f65c1480d535930ee8f0b91f5f8","runtime/moth_runtime_v5_2/compiled_fields.py":"56749fdcd879c342b2da6190d2b75b1a4d243ea0608c883b5129c60ece044e17","runtime/moth_runtime_v5_2/conversation/__init__.py":"817437792b512923e18d3ed47694af7116a968e2fe81aeddd64af4bf5111936a","runtime/moth_runtime_v5_2/conversation/context.py":"d2c60842446a711c5ff54f4dc0adc00ab3665dff4bf6d49cc58c79d63a766be3","runtime/moth_runtime_v5_2/energy/__init__.py":"80d419f8ece237194b7de1aac301facd6afc9ac11f77ded71c41edd9d9b65172","runtime/moth_runtime_v5_2/energy/activation.py":"73d63666ef3749eedf25fd61b73e3280ee2190321e74e536aadb8f9c91cfc8bf","runtime/moth_runtime_v5_2/energy/loader.py":"5d220a63a42b4521ce643bc645973291b1ff3a8fc38e89955cf7c0dc7438f881","runtime/moth_runtime_v5_2/energy/schema.py":"dcbba25edec713ef9756f032fd28bc3fa83fb00336980fb82d6dc9cefbba2a62","runtime/moth_runtime_v5_2/energy/settlement.py":"a3dd5f0a996ca61d584d8f1d830d7aefc318e728ee88c56c7dba9baa5f44383d","runtime/moth_runtime_v5_2/kernel.py":"15375b869c806b45c710605daf43a177de5da77206207aa335017fb3054607ea","runtime/moth_runtime_v5_2/persistence/__init__.py":"741fbc5e7c631f94900d21704a8c1243453736afabdac403c323a56fc25640d1","runtime/moth_runtime_v5_2/persistence/layers.py":"e755df6186fe17d7a23fdb5416cfa7d828195b5ff6270469e67ca049f322c055","runtime/moth_runtime_v5_2/persistence/objects.py":"cb69065caac3b00790972956f9b3bb888ce8b11c3d254060ea94319e74b63ddb","runtime/moth_runtime_v5_2/persistence/store.py":"aadcda70550dd2baec65e30321489f2f7fbd6bec4827d91e80489cfffbf5eb9e","runtime/moth_runtime_v5_2/runtime.py":"e814b18ac3a42ed6bcadda39316670ee2c574731f9f9ab538273a3b66724c10f","runtime/moth_runtime_v5_2/surface.py":"901b7562215eba3a056bca5bb5b